<?xml version="1.0" encoding="UTF-8"?>
<networkDefinition xmlns="http://www.example.org/nffgInfo"
	xmlns:xsi="http://www.w3.org/2001/XMLSchema-instance"
	xsi:schemaLocation="http://www.example.org/nffgInfo nffgInfo2.xsd">
	<nffg name="fg1">
		<updateTime>2016-11-21T16:00:00</updateTime>
		<nodes>
			<node name="node1">
				<funcType>WEB_CLIENT</funcType>
			</node>
			<node name="node2">
				<funcType>WEB_SERVER</funcType>
			</node>
		</nodes>
		<links>
			<link name="StoC">
				<destinationNode name="node1" />
				<sourceNode name="node2" />
			</link>
			<link name="CtoS">
				<destinationNode name="node2" />
				<sourceNode name="node1" />
			</link>
		</links>
	</nffg>
	<nffg name="fg1">
		<updateTime>2016-11-21T16:00:00</updateTime>
		<nodes>
			<node name="node1">
				<funcType>WEB_CLIENT</funcType>
			</node>
			<node name="node2">
				<funcType>WEB_SERVER</funcType>
			</node>
		</nodes>
		<links>
			<link name="CtoS">
				<destinationNode name="node2" />
				<sourceNode name="node1" />
			</link>
			<link name="StoC">
				<destinationNode name="node1" />
				<sourceNode name="node2" />
			</link>
		</links>
	</nffg>
</networkDefinition>